content_type,author,subreddit,score,created,url,text,num_comments,Consumer_Vulnerability,Service_Failure_and_Recovery,Trust_and_Relationship_Breakdown,Marketplace_Exclusion_and_Identity
post,Forgets2WaterPlants,Menopause,463,2025-10-11T00:06:47Z,https://www.reddit.com/r/Menopause/comments/1o3h8q8/this_country_would_save_so_much_money_if_we_took/,"This country would save so much money if we took menopause seriously (mini-rant)

OK, I gotta spout of. Just hit me today how many millions - if not billions - we could save in healthcare spend if we invested in research and education on menopause and all it touches. So many people here have wasted \*years\* dealing with misdiagnosed symptoms and conditions - sometimes with treatment that led to new issues and problems - only to have everything resolve or improve after starting HRT. Yet, we have to fight our doctors for it AND too many don't understand it. If the hormones are behind  conditions for which we've been going to a PCP, dermo, neurologst, orthopedist, allergist, ENT, etc etc etc THEY should all be trained in they relate to/result from peri and menopause. AND, women need related education and consultation from their thirties on! And for that we need RESEARCH!!!!! Not just by the drug companies making the hormones, but across specialties! 

  
GAH - the nonsense of it all makes me want to scream.

Whose with me on this?

  
",94.0,Yes,Yes,No,No
post,Skimamma145,Menopause,233,2025-10-13T17:21:01Z,https://www.reddit.com/r/Menopause/comments/1o5q0g3/great_post_by_dr_jen_gunter_debunking_influencer/,"Great post by Dr Jen Gunter debunking influencer speak and explaining the science-“Menopause Hormone Therapy: Politics and Personal Agendas are Threatening Science”

…
I want to focus on the online public commentary that the FDA opened up for MHT, specifically about systemic hormones (estrogen with or without a progestogen). I submitted something (you can read it here), but I want to discuss and share the response submitted by the WHI Steering Committee as their data has been abused and cherry picked by Makary and many others. You can read their full commentary here, but I will break down the key points, which, coincidentally are the same three key points that Makary messed up in his book, Blind Spots (irony is dead, I tell you).


The Preamble

Before we begin, I need to clarify that the WHI is not a terrible study.

I see this a lot on social media. I am also asked about “that terrible study” daily by patients. Despite what Makary and the menopause influencers who appear to profit from a scientifically flawed “hormones fix everything” perspective, the WHI was not a bad study. The investigators did not randomize people incorrectly, nor did they screw up the statistics, and there were not too many protocol violations (which are some of the ways that studies can be problematic). This matters because misinformation about the WHI is leading some practitioners to completely disregard the largest randomized clinical trial for women or to cherry-pick it to death because they don’t like or understand the results. Disavowing quality research harms women, because it misleads them about the data and, it sets the precedent that women’s don’t need science, the opinion of influencers is all tat matters.

For the record, the WHI was not designed to look at the risk/benefit ratio for managing symptoms of menopause with MHT. It was primarily designed to look at the potential cardiac benefits of MHT, as observational studies suggested a benefit. Premarin and medroxyprogesterone acetate was specifically chosen because this was the most common regimen at the time and people believed this specific combination protected the heart based on the observational studies.

Misinformation about the WHI is leading some to completely disregard the largest randomized clinical trial for women or to cherry-pick it to death because they don’t like or understand the results

-Claims of Prevention of Heart Disease and Reduction in Mortality from MHT

Several speakers at the expert panel spoke as if the timing hypothesis regarding MHT was proven as fact. This is the idea that when MHT is given within a few years of the last period it can be protective for the heart and reduce mortality, but when given later, it is not, and may even be harmful. This hypotheses has been largely used to explain away the findings of the WHI. The problem is that the timing hypothesis is exactly that, a hypothesis, and it’s far from settled science.

It’s true that the WHI showed that younger women did have a lower risk of cardiovascular disease with MHT than older women but in their letter, the WHI Steering Committee highlight several key issues:

Younger women have a lower risk of cardiovascular disease than older women by virtue of being younger. To actually support the timing hypothesis the results would need to hold up after 20 or so years of hormone and placebo use. We don’t have that data. Both the ELITE and KEEPS trials were deigned to test the timing hypothesis, and they were unsuccessful.
During the expert panel, data was shown for the age group 50-59 years which did show a low absolute cardiac risk for women taking MHT, but, according to the WHI Steering Committee, “The data shown are correct, but somewhat misleading. For most health outcomes there was no statistical evidence that the MHT relative risks differed by age groups.” In addition, the information that was presented at the FDA panel was cherry picked, as data showing a reduction in risk (for fractures and diabetes) was shown, but similar data showing an increase in risk (for gallbladder disease and urinary incontinence) was conveniently not shared.
A claim was made that 50,000 women died prematurely over 10 years because they were denied MHT, but that is not supported by the data. During the trial there was no significant effect on all-cause mortality for the combined hormone arm. After 18 years of follow-up there was no statistically significant difference in all-cause mortality. It’s hardly possible to project an excess of 50,000 additional deaths when there was no statistically significant difference in all-cause mortality.
There is a Finnish study that Makary seems obsessed with and was brought up at the expert panel. I wrote about it here, and the claim is that 27% of women will die in their first year after stopping MHT, hence, stopping MHT kills women. The WHI Steering Committee rightly points out that is an observational study and the WHI, AN ACTUAL CLINICAL TRIAL (I am getting a little shouty here, my emphasis not the WHI Steering Committee) showed there was no increased risk of heart attacks upon stopping the hormones. Hmm, what do we accept, an observational study with a lot of limitations (like a lot, as in the dose or duration or type of hormones were all unknown) or a randomized controlled clinical trial? Le Sigh.


-The Timing Hypothesis and Dementia

The expert panel was provided with data that claimed MHT is associated with a lower risk of dementia, but this was based on studies of brain metabolism and observational data, so once again, not clinical trials and evidence of cause and effect. The WHI Steering Committee wrote, “We do not have long term trials of MHT for dementia prevention started in early menopause, but in the WHI trial of women aged 50-55 studied ~7 years after trial ended there was no residual benefit for MHT regarding cognition. In women aged 65 and older, there was harm for probable dementia/mild cognitive impairment during the trials. We encourage the FDA to review WHI’s MHT trial results on cognitive function, mild cognitive impairment, and probable dementia.”

Once again, I remind people that all the data on MHT and dementia was reviewed at the 2024 Menopause Society Annual Meeting and we were explicitly told that science does not support starting MHT to prevent dementia

-Misleading Information about Cancers, Especially Breast Cancer

The WHI Steering Committee wrote, “The presentations and discussions were potentially misleading, particularly regarding breast cancer, and incorrect for other cancers. Most importantly, it was repeatedly mentioned that the 2002 CEE+MPA paper only “suggested” an increase in breast cancer incidence and that there was no significant increase in breast cancer mortality. This statement distorts the appropriate statistical inference and ignores the totality of the evidence that has been presented over time.”

The combined MHT arm (Premarin plus progestin) was stopped on the advice of an independent data safety monitoring board when the risk of breast cancer crossed the “prespecified monitoring boundary for harm.” The risk of invasive breast cancer increased progressively over time and later became statistically significant. In addition, “a recent published update reported a statistically significant 28% increase at 20 years of cumulative followup, again with no variation by age group and in fact the age group younger than 60 years had a significantly increased cumulative risk (HR 1.36; 95%CI 1.09 - 1.69).”

There is a claim that only women who had previously been exposed to hormones developed breast cancer on the WHI, and those with no prior use did not. This is sometimes used in what I can only be described as incredible feat of mental gymnastics to explain away the increased risk of breast cancer. in the WHI. It is true that women who had taken combined MHT prior to the WHI were initially at higher risk of breast cancer than those who had never taken it. However, there was no difference at 20 years, showing both groups, those who had previously used hormone therapy and those who had not, had increased risks of breast cancer. What this does support is that it takes several years for that increased risk to emerge, which is encouraging. What I tell people is that you have a few years to see if this works for you before the risk starts to rise and then you can decide if that risk is then worth it to you.

The WHI Steering Committee took issue with the statement from the expert panel that combined MHT showed no increase in mortality related to breast cancer. Women with breast cancer undergo chemotherapy, radiation therapy, surgery and all the complications of those treatments in addition to the stress. I know many women who have had all those therapies, and to wave that off as if mortality is the only outcome is both bizarre and dismissive. Also the 11 year mark there was an increase in breast cancer mortality, but by year 20, that no longer held true.

And the following is too important for me to paraphrase:

During the panel discussion, a speaker claimed that the decline in U.S. breast cancer incidence that followed the stopping of the WHI CEE+MPA trial was “a statistical change in how the data was being analyzed by the group from the CDC.” The speaker’s claim is unsubstantiated and not consistent with SEER coding. The report by Ravdin et al. (2007) attributed the sharp decline in U.S. breast cancer incidence after 2002 primarily to the abrupt reduction in postmenopausal hormone therapy use, particularly combined estrogen plus progestin, following the early termination of the WHI CEE+MPA trial. The analysis was peer-reviewed and published in one of the most rigorous medical journals. There are no known technical flaws in the methodology, NEJM has never retracted, corrected, or revised these findings. We encourage the FDA to fully examine the U.S. breast cancer incidence following the stopping of the WHI trial, and temporal trends reported by Chlebowski et al.

Regarding other cancers, the WHI Steering Committee stated “The speaker’s statements regarding WHI portrayal of MHT’s association with lung cancer and ovarian cancer are inaccurate.”

-Yeah, It’s a Lot

At this point you might think that I am anti-MHT. I am not. I appropriately prescribe it to patients on a regular basis. Absolute risks for most women under age 65 are low. For example, the risk of breast cancer attributed to Premarin and medroxyprogesterone acetate (the combined hormone arm) is about 6/10,000 women per year for a woman between the ages of 50-59. We think it is lower with progesterone, but it’s important to be honest that data comes from observational studies, so we can not be definitive. In addition, a different estrogen, for example estradiol which is used more commonly now, may also have a different impact. The risks are different as women age.

MHT is the gold standard for hot flashes and night sweats and can be very helpful in preventing osteoporosis for those at risk. I also prescribe MHT for symptoms that have emerged around menopause that we don’t know for sure if they are due to menopause or not, because the WHI reassures me it is a safe therapy and if the symptoms, for example burning mouth or muscle pain, don’t resolve with several months of therapy, then my patient has been exposed to a very low risk to see if MHT might help her or not. I also have a book with a lot of information on MHT (The Menopause Manifesto) and a large series of articles here on The Vajenda with the facts about MHT and how to take it in the most evidence-based way possible. Anyone who says that I am anti-MHT is cherry-picking, which says a lot about them.

What I despise is the misrepresentation of studies, because I believe that women deserve science from unbiased sources so they can make informed decisions. It’s wrong to tell women that MHT can prevent heart disease or dementia when we don’t have the data to back up that claim. Telling the truth is really a low bar, one that Marty Makary seems to have difficulty clearing and that’s pretty sad. I encourage you to read the entire letter from the WHI Steering Committtee and to share it.

Abusing the WHI and cherry picking studies about MHT almost feels like a competitive sport among some menoinfluencers. The irony is that I am sure everyone who has abused the WHI, the largest clinical trial for women, and cherry-picked what they want from its carcass has also likely complained about women’s health being understudied. Can’t quite find a superlative for that level of irony.

It seems like a foregone conclusion that FDA will alter MHT labeling, and if they do it will be in large part due to a complete rewriting of the WHI along with abandonment of the traditional scientific process and disregard for transparency. Makary seems to reward and revel in spectacle and propaganda, which does not advance science or health.

The truth is, the WHI is simply inconvenient for Makary and many influencers. As one person who was involved with the study once told me, the WHI is pretty great evidence that hormones aren’t going to kill you and that they are also not going to make you live forever. But where’s the profit in that?



Manson JE, Crandall CJ, Rossouw JE, Chlebowski RT, Anderson GL, Stefanick ML, Aragaki AK, Cauley JA, Wells GL, LaCroix AZ, Thomson CA, Neuhouser ML, Van Horn L, Kooperberg C, Howard BV, Tinker LF, Wactawski-Wende J, Shumaker SA, Prentice RL. The Women’s Health Initiative Randomized Trials and Clinical Practice: A Review. JAMA. 2024 May 28;331(20):1748-1760. doi: 10.1001/jama.2024.6542. PMID: 38691368.

Manson JE﻿, Aragaki AK﻿, Rossouw JE﻿, et al; WHI Investigators. Menopausal hormone therapy and long-term all-cause and cause-specific mortality: the Women’s Health Initiative randomized trials. ﻿ JAMA. 2017;318(10):927-938.

Anderson GL, Chlebowski RT, Rossouw JE, Rodabough RJ, McTiernan A, Margolis KL, Aggerwal A, David Curb J, Hendrix SL, Allan Hubbell F, Khandekar J, Lane DS, Lasser N, Lopez AM, Potter J, Ritenbaugh C. Prior hormone therapy and breast cancer risk in the Women’s Health Initiative randomized trial of estrogen plus progestin. Maturitas. 2006 Sep 20;55(2):103-15. doi: 10.1016/j.maturitas.2006.05.004. Epub 2006 Jul 11. PMID: 16815651.

Chlebowski RT, Anderson GL, Aragaki AK, et al. Association of Menopausal Hormone Therapy With Breast Cancer Incidence and Mortality During Longterm Follow-up of the Women’s Health Initiative Randomized Clinical Trials. JAMA. 2020;324(4):369-380.",80.0,Yes,Yes,Yes,Yes
post,tropicalazure,ChronicIllness,207,2025-10-15T18:02:11Z,https://www.reddit.com/r/ChronicIllness/comments/1o7ibjq/this_is_a_vent_it_will_probably_offend_people/,"This is a vent. It will probably offend people. Fair warning... but I need to get this out.

  
Right now I am Not good. I want to wash my hair and I can't and even if it is washed FOR me that's too much.  I sit on the stupid little stool, and shiver while my lovely mum washes my hair FOR me, once a week...     
    
Yesterday we did a hair wash.  I had energy beforehand.  I sat on the stupid stool.  We used lukewarm water.  I shivered. My toes went blue.  I washed my body afterwards (which I can often do without immediate issue.. sometimes I even feel better after..).  Then I dried my hair with a lightweight hairdryer on gentle warm.  I spent THREE HOURS feeling shattered, which suddenly stopped after having food, like a switch.  Which then progressed to my tonsil flaring up as a stress reaction. Which then progressed to SIX HOURS OF MALAISE which randomly stopped later in bed when I lay on my right side.  THE ACTUAL FUCKING FUCK!?    
    
I can lie here feeling like my body is brewing flu, and then get distracted or eat a biscuit and it just STOPS.  For hours.. days... it just STOPS. But there's no logic.  I can't MAKE it stop.  The switches are not in my control.    
    
Even if I Rest and Pace like a Good Little Chronic Illness Spoonie Potsie Warrior (UGH FUCK VOM) I want to wake up and feel like I slept AT ALL.  Sometimes my sinuses slam shut and I can't breathe overnight and they pop and click open and  this usually happens during flares and I DONT KNOW WHY.     
  
This shit isn't inspirational.  This is literal second by second psychological, emotional and physical torture  that if it were patented and used in black sites, would be HIGHLY FUCKING EFFECTIVE.  I am not a fucking Spoonie.  I am not a Warrior.  I am just one fragile fucking human who is living a daily assault from all sides and is broken in all the ways that a person can be.  There is no sugar coating this.  And infantile language like Spoonie or Potsie or Illness Warrior makes me want to scream.  And simply reading the words ""rest and pace"" and ""energy envelope"" and ""baseline"" literally makes me feel physically sick and anxious.  It's like those words now elicit a genuine trauma response.

The other day I was talking to Dad and I suddenly felt like I was pushing against a wall, and couldn't quite breathe normally.  Then my tongue and mouth went numb. And my body went severely jittery and my legs began giving way.  And it took HOURS to resolve fully.    
    
Last few weeks, I'm sleeping 12 hours a day. I wake up in the afternoons. I lie here til I feel human.  I have never lived in bed this long.  But I don't know what else to do.  I hate it.  I want to get up.  I woke up this morning sweating and disgusting with my hair stuck to me and my scalp and ears itching and I WANTED A SHOWER SO BADLY and knew I couldn't  and I just bawled.  I was barely conscious and I was there, gross, smelly, tired and howling like a baby.    
    
My lovely family help becsuse I definitely couldn't feed myself if I was alone and that is FUCKING TERRIFYING.  And at some point i feel able to move, and I might wash my face and clean my teeth and go downstairs, feeling otherwize unwashed and disgusting.  I don't know how much now is fear vs actual incapacity.  But I am SO scared ALL THE TIME.      
    
I don't want this! What the fjck did I do to deserve this when everyone else I know is fucking FINE!?      
    
I get Covid ONCE and suddenly I'm having multiple retinal detachments, eyes inflammation, weird lesions, skin doesn't heal, scalp goes to hell, face flushes and peels and turns to dust, nervous system in the bin, uterine cancer, burning nerve pain, screaming tinnitus, did I mention the nervous system is FUCKED!? And suddenly I can't sleep overnight, despite a lifetime of no sleep issues (WOW HOW LUCKY WAS I!.!.!) And I'm flinching and crying at tiny noises several houses away... great, I now have SUPER hearing that makes me tremble and cry.     
    
And I HAVE to attend medical appointments for my eyes.. often 6 hours plus, and I have to get through those....  and it's getting harder and harder.    
    
I want my legs to work and my arms to stop burning.  And my heels to stop feel like I'm permenantly treading on lego. And random sneezes to stop kicking off malaise that makes me feel like I have insta-flu FOR NINE HOURS.  And my hands to stop burning.  And my legs dragging or collapsing. And my face to stop pulsing. And my scalp to stop rotting. And my blood to stop vibrating inside my damn body. And to stop jolting awake every hour and flinching at tiny noises that no one hears.      
    
FUCK GODDAMIT I WANT TO WASH MY HAIR.   And I want crying about not being fucking able to do it, not vault me into a whole new circle of hell where I can't do anything else either. Fuck fuck fjck fuck.     
    
 I want to shave my entire head and take a stripping blade to it to scrape off the absolute fucking SKANK that keeps growing on it because I CANT WASH MY FUCKING HAIR PROPERLY and it itches and burns and flakes and scabs and I wake up scratching and digging chunks of scalp flesh out and crying before I'm even fully fucking conscious and is FJCKKNG GODDAMN RELENTLESS.     
    
I wake up. I cry.  I cry myself to sleep.  I cry looking in the mirror.  I watch my body bloating and flaking and scabbing and rotting and nothing helps.  Nothing ever fuckkng helps.  I just keep getting worse.    
    
Always worse.  I pace.  I rest.  I try.  I'm not perfect.  But when yoga nidra made my head burn permanently, and sticky itchy flaking seb derm on my scalp and ears makes lying down a literal sensory hell, and when brown noise makes my body tremble inside, and someone literally washing my hair for me, makes me worse, WHAT THE FUCK AM I SUPPOSE TO DO!?    
    
I want to lie here and fade away.  My spirit is dead but my body persists.    
    
    
OH  MY ACTJAL FUCKING GOD.  GUEESS I BETTER SLEEP HUH!?!?!  HUH!?!?!? MORE FUCKING HAPPY HAPPY JOY JOY YAAAAYYYYY FUN TIMES TOMORROW FUCK THIS ABAOLUTE GODAMN FUCKING SHIT IM SO SCARED I WANT ME BACK I WANT ME BACK I WANT ME BACK OH MY GOD ITS NEVER GOING TO STOP IS IT THIS IS IT FUCK",44.0,Yes,Yes,Yes,Yes
post,Local_War_9122,Endometriosis,93,2025-10-14T13:20:13Z,https://www.reddit.com/r/endometriosis/comments/1o6fbot/you_should_just_stop_being_so_dramatic/,"You should just stop being so dramatic

Can you just stop being so dramatic? My mum's friend has endometriosis, and it's just a bad period pain. Nothing more. Take ibuprofen, and you'll be fine. 

If you could just do some more sports or go for longer walks, you would feel much better. Maybe you just sit too much. It can't ache that bad, if all your blood tests and imaging are normal. So maybe it's all in your head. If you could just look at the pain from a different angle, you would feel better. 

It might also be because you're in your 30-s and still have no baby. Of course, the body won't be happy with your choices. Each woman should have a baby. This is what you are born for. 

This is what we have to hear for years, ladies. If only other people could realise that if their periods are painless, it doesn't mean that other women's periods or the whole cycle is also like that. If only doctors could understand that I don't go to the appointments because I enjoy them. I go there and cry there because I can't bear this pain anymore. If only people who become doctors really wanted to help people, not just sit the whole day filling the documents and being patronising, saying that you are too young to be in this pain or just have a baby, it will feel better. Just so tired of that.",31.0,Yes,No,No,Yes
post,TheSnaccckParadox,WomensHealth,82,2025-10-14T16:01:49Z,https://www.reddit.com/r/WomensHealth/comments/1o6jjbt/why_just_rest_never_worked/,"Why just rest never worked

I felt like this countless times sick, drained, exhausted someone always says Just rest you will feel better. So I try, I nap, go to bed early, cancel plans, do all the rest move but I wake up the next day feeling just as heavy or worse. Last weekend was a perfect example I been pushing through busy days, skipped meals, ignored signs. By Friday evening I was done I slept 10 hours, no alarms or distractions still woke up dragging, achy in places I didnt even know were sore brain fog thicker than molasses. I started tracking things down myself, even put stuff on eureka health just to check and see why resting sometimes feels pointless. Its not quitting its detective work. Rest by itself isnt a cure its a reset button that only works when you address the underlying stuff nutrition, stress, inflammation, hormones the things you can’t just sleep off. What finally made your body believe it was safe to slow down?",14.0,No,Yes,No,Yes
