content_type,author,subreddit,score,created,url,text,num_comments,Consumer_Vulnerability,Service_Failure_and_Recovery,Trust_and_Relationship_Breakdown,Marketplace_Exclusion_and_Identity
post,Kat_Scales,Perimenopause,6,2025-10-15T04:24:23Z,https://www.reddit.com/r/Perimenopause/comments/1o71gzl/the_cramps_are_back/,"The cramps are back.

I am freshly in perimenopause, despite only being 36. My obgyn almost didn't believe me, but I had every symptom and nothing else could be causing them. They put me on hormones, low dose of estrogen and progesterone, and told me to keep my IUD until it's time to take it out. 

The symptoms of perimenopause were gone almost within a day of starting the hormones, and I was naively very excited and happy. I did have some indigestion at the beginning but that seems to have resolved. 

Some backstory here, I've had horribly painful periods my whole life. I would walk hunched over because it hurt so bad, and sometimes the pain would make me vomit. I had an ovarian cyst burst because I assumed the pain was just my usual cramps. (They only found out because my teacher sent me to the nurse because I was silently crying in the back of the room. I don't know how the nurse knew something was different, but she told my dad to take me to the hospital, and they found the cyst on ultrasound.) As an adult, I tried all the oral birth control. Most of them messed with my mental health, so I eventually got on Mirena. It's been a lifesaver. I haven't had cramps since then (probably close to 15 years), except for when I was pregnant and those, ironically, weren't as bad.

Anyway, I've had cramps twice since starting the hormones. The first time I didn't even recognize them. When they steadily got worse, I went 'oh' and just took a nap. They got better pretty quickly. This time, I feel like death. I'm nauseous, curled into a ball in bed, and in a lot of pain. I had forgotten how bad my cramps used to be. 

Anyway, part of this was me wanting to rant. But I guess I also want to know, is the cramping normal, do you think? Should I message my obgyn?",4.0,Yes,Yes,No,Yes
post,ToadCroaks,Menopause,6,2025-10-11T02:03:23Z,https://www.reddit.com/r/Menopause/comments/1o3jlx4/skin_itching_pins_and_needles_crawling_even_after/,"Skin itching, pins and needles, crawling even after starting HRT

Context: just turned 30 year and went into primary ovarian failure which has been a nightmare and ruined my life and body. 

For those who don't know, primary ovarian failure is sudden onset of premature menopause.

Hey,

I wanna know if anyone with POF (or is in menopause) has this symptom. I'm on HRT yet the skin issue keep worsening. It's a constant feeling of tingling, crawling, pins and needles that is quite itchy at the surface of my skin. 24/7 and sometimes feels as severe as constantly being zapped. 

It has not gotten better on HRT. Many symptoms are under control:
- sleep, hot flashes, night sweats, anxiety, sexual dysfunction, bladder issues were all solved for the most part. Depression would have gone away too if it weren't for me wasting away. But I find myself severely depressed due to this mysterious illness.

The muscle wastage and the skin issues especially are so bad and won't go away. The skin issue is my most severe symptom and I can't figure out what's causing it. It's quite unbearable as it is constant. Sometimes the tingling goes away for short periods but not long. 

It's accompanied by collagen and elastin loss. It's happening very rapidly too. My skin becomes more and more creepey, thin, lax, stretchy and just old looking all over my face and body and it's really severe. No one knows what's going on or why it's happening. This degradation started to happen right after I went into POF / on the same day. 

My skin is also incredibly dry and this also hasn't resolved with HRT. Eyes and mouth tend to be dry too.

Is anyone going through this?
Has anyone gone through this but been able to solve the issue?
It's so distressing and driving me insane. 
I fear for my sanity and will to live long run.

It's only been 7-8 months since I went into full POF and my skin has already aged 20 years with NO signs of slowing down.

I really won't understand what's going on and am desperate for answers. My skin had always been perfect all my life. No acne, pimples, wound healed fast. Collagen was high quality and my skin was very hydrated.

Don't understand what's causing this...

I pray I find an answer because it's costing me my will to live.",12.0,Yes,Yes,No,Yes
post,Ogbone_98,ChronicIllness,6,2025-10-14T02:21:45Z,https://www.reddit.com/r/ChronicIllness/comments/1o63he5/feel_very_sick_just_missing_a_diagnosis/,"Feel very sick, just missing a diagnosis

So around late may of 2024, I was playing video games. When all of a sudden I started having really sharp pain in my chest. I thought it would go away if I laid down or drank some water, but it just got worse. Eventuallly it got so bad I could take it and told my dad to take me to the hospital. I was told everything was fine, no elevated enzymes or something indicating a heart attack and head CT scan came back clean as well. 
I thought I was fine since my scans and bloodwork came back clean, but I we to work the next day and I started to feel like complete crap. Dizzy, chest pain, rapid heart beat, and I work as a pool man so I need to be physically active. I somehow managed to finish the day, but I never got better. 
Just wants to add that I also had a cardiologist since 2018 because I was feeling tired faster than my friends and they found out I have a leaky mitral valve. Doctor told me it was nothing to be worried about until im 50, 60 or so. Every year I would get a stress test, echo, 24 hour monitor, every other year they would check my neck with the echo. Found nothing though out the years. My last appointment was on April of 2024 for an echo and they told me everything was fine. I don't think these doctors had my best interest in mind

Fast forward to today, and I never got any better. I have been to the emergency room a handful of times for the same thing and now and they tell me I'm fine. I don't want to be diagnosed with something, but I really do feel like I need some help

My parents and siblings think im just lazy and dont want to work anymore, but it couldn't be far from the truth. I actually want to support my family and myself since I haven't been working from may of 2024. It just sucks and I'm kinda scared. Not really sure what i can do to better my situation",6.0,Yes,No,No,Yes
comment,thaiearltea,AskDocs,6,2025-10-09T04:41:17Z,https://www.reddit.com/r/AskDocs/comments/1o1whe1/acetaminophen_allergy/nijohug/,"like you said, it’s super uncommon to be allergic to the drug itself. i’m not a doctor yet, but I’ll tell you a story that happened to my sister within the past year. She had taken acetaminophen for years, but took a different OTC brand of it and ended up in the ER with a full body rash. her ER doctor said it could have been an ingredient in the capsule that her body reacted to 🤷‍♀️ this is 100% worth bringing up to your primary care doc when you have your next appointment!",,No,No,No,No
post,LastOutlandishness,Perimenopause,6,2025-10-13T16:49:23Z,https://www.reddit.com/r/Perimenopause/comments/1o5p3xr/if_not_peri_what/,"If not Peri, what?

I’m 33. I’ve had significant shifts in my cycles since having my daughter at 30, but over the last year or so I’ve had a lot of changes that mimic perimenopause.

My cycle was always like clockwork (29day cycle) then it became longer or shorter (24 days as long as 38 days) - so much of a variability my clue app put me in perimenopause mode. My period itself has changed over time and I’ve had new symptoms (brown bloody discharge days before) to my breast pain and swelling for a week before, and now just a super heavy period for about a day with clots and then just spotting for another day or two. I used never really have any symptoms other than horrific cramps in my teens and early twenties, but now I cramp and have a ton of what feels like back labor (which makes sense because of how much blood I lose so quickly).

I have chronic migraine and have been getting violently ill before my cycles with aura migraines. 

I never really had pms (maybe when I was a teenager I’d get emotional) now a week/10 days before I cry or rage at just about anything. 

My sleep habits are so messed up for the last 8 months or so I wake up several nights a week around 2-3am and can’t go back to sleep until after 5. My alarm goes off at 5:30a. Other times I’m up all night. 

I’m hot and then cold. I can’t get comfortable at night. If I do any kind of activity I’m flushed and can’t cool down. 

Routine physicals - all my labs everything is normal. My primary care has done extra testing for my thyroid due to family history and all within normal range. 

She’s checked my FSH and estradiol and normal. 

She’s also done some tests to rule out autoimmune. 

I feel like I’m losing my mind and I don’t know how to support myself or what changes to make or what I can do. Maybe I am too young, but if it’s not the start of perimenopause any thoughts on what? I’m looking for resources or advice on how to get my quality of life back because I’m slowly losing it.",7.0,Yes,No,No,Yes
post,Physical_Bed918,Menopause,6,2025-10-11T19:12:12Z,https://www.reddit.com/r/Menopause/comments/1o442dl/perimenopause_update_joint_aches_and_pains_and/,"Perimenopause Update Joint Aches and Pains and Anxiety.

Just in case someone is in a similar perimenopause boat as I am and have been following my progress I'm still hanging in their on birth control and Mirtazapine. Tried literally everything else with no luck. Have been in peri over 2 and a half years, on Nortrel 5/35 birth control continuously no breaks for menstruation approximately 1 and a half years and Mirtazapine approximately 10 months. I have been feeling close to normal for the last month, no joint aches and pains, less back pain, almost no hot flashes, less anxiety, less nausea, less pain and haven't bleed which is the longest or tied with the longest I haven't bleed in 2 and a half years, I've been bleeding most of this time no matter if I was on HRT or birth control. Headaches have been fewer and shorter in length too but worse when they happen. Right before this month of feeling a lot better I had 4 days of feeling like hell, cramps, pain, 4 day headache, dizziness, anxiety, nausea and almost constant hot flashes. So I'm not sure how long this break from bleeding and month of lessened symptoms will last but hoping I'm finally going to feel okay eventually after so many years of suffering. Best of luck to everyone in the perimenopause trenches ❤️",0.0,No,No,No,No
comment,crazfulla,TwoXChromosomes,6,2025-10-09T05:00:30Z,https://www.reddit.com/r/TwoXChromosomes/comments/1o1wqtx/why_do_i_orgasm_so_fast/nijqs2d/,"It could be due to a few factors, some of which will probably be biological. Possibly even genetic. But we obviously can't answer that for sure. It's normal when you're young and inexperienced to become more excited more quickly. But everyone is different and will experience things differently. It doesn't necessarily mean there's anything wrong. Although if you have any concerns you can always ask your doctor.",,Yes,No,No,No
post,Froggymnx,ChronicIllness,5,2025-10-08T09:05:36Z,https://www.reddit.com/r/ChronicIllness/comments/1o15g0c/sick_of_being_sick_and_not_being_taken_seriously/,"Sick of being sick and not being taken seriously *vent*

!!!!TW!!!! Mention of bulimia in rant
Mods please delete if not allowed 

I dont even know where to start but im at my wits end. About a year ago I was driving home from TMS therapy and suddenly got so dizzy I needed to pull over, I tried laying back for a while in the seat, but it wasn't getting better. I started feeling sick in genral and ended up having my car towed home. Over the next couple of weeks I kept having random days pop up where I was super dizzy, unable to focus on driving, and felt almost drunk/sick at the same time. TMS wasn't working and driving was getting harder for me to do, so I stopped doing TMS therapy. After that I started having more symptoms pop up. EX: dizziness upon standing, horrible chronic fatigue, the room spinning even when laying down, air hunger, feeling like im going to faint from doing a 30 minute shopping trip, unable to stand in the shower or while doing chores. Eventually I became bed ridden by choice to not flair up these symptoms. Even laying down all day I feel horrible, I always feel like im just getting over a bad flu most days. Everyday I deal with horrible back pain after standing more than 5 minutes, dizziness, heart palpitations, high bpm for no reason, digestive issues, pressure in my head, headaches, overall feeling faint/weak through my entire body, feeling hot all the time, elevatedtemperaturebut never a full fever, bad balance. My most recent symptoms to pop up were blood in stool, slow digestion, and feeling extremely bloated all the time. I could eat a pb&amp;j sandwich and feel like I ate a whole Thanksgiving dinner. I had a really bad doctor who dismissed my symptoms as anxiety and being over weight, got a new one, had insurance issues for months and he wasn't even supposed to be taking on new patients so he dropped me while I wasn't covered. Got a new one and he did all the regualr tests and of course everything came back normal except for low ferratin. He put me on a iron supplement and fiber supplement. Nothing has changed except for no more blood in my stool. My digestion has slowed so bad that after eating one french bread pizza and constantly gasping/yawning for air for 3 hours i decided to make myself throw up what i ate hoping it would help me feel better. It might sound stupid but I felt so extremely full and like i couldnt breathe that i did it. After throwing everything up i notcied that nothing had been digested. I literally threw up chewed up bites of food and bile, no signs of digestion. Im still dealing with all other symptoms and now feel like I can't breathe anytime I eat. Im lucky if I get one meal a day in. Im constantly sighing and yawning for air. Im just at the end of my rope,  its been an entire year of the issues I listed above and probably some I forgot. Im no closer to finding out whats wrong with me and my doctor seems to be tired of me after one visit. I sent him a couple of follow up messages after and each one he was shorter and shorter with me. I sent him a message Friday asking him for a refill on meds I was out of and he didn't respond, finally filled them today and still has not sent me any message about it. I feel like he either doesnt care or doesn't know. I'm no closer to any diagnosis and more issues are popping up. Im thinking about just requesting a new doctor but I don't want to be labeled as a Dr. shopper in the office bc then I'll be taken less seriously than I already am. My body is broken and they dont care. I dont know what to do anymore. Any advice is welcome.",0.0,Yes,Yes,No,Yes
comment,Vivalaviv_,AskDocs,5,2025-10-09T13:13:58Z,https://www.reddit.com/r/AskDocs/comments/1o1ywx5/my_23_year_old_brother_has_end_stage_liver/nilav88/,"Thank you so much for your thoughtful reply.

He actually never drank alcohol at all, but he’s had many unexplained medical issues throughout his life. For example, he once suddenly developed paralysis on one side of his face, and he also has a skin condition where he’s lost pigmentation in some areas.

He’s also immunocompromised, which might be connected somehow. He was only diagnosed with Child-Pugh C about two weeks ago, so everything still feels very new. Maybe that’s the reason why he still can do all the things he’s doing? He’s also someone who pushes through and like things to be normal. I wish he slowed down..

He hasn’t had many hospitalizations yet, but he’s been going through lots of tests and medical appointments recently. I don’t think he’s on any specific medications right now — he told us there isn’t much they can do — but I’ve read there might be treatments that can at least help manage symptoms or prevent complications. I’m not sure if that’s true or he is rejecting care or very pessimistic. Because he already said that when this lever disease will cause cancer, he doesn’t think he can do chemo with a weak body and immunocompromised. And IF he can, he probably doesn’t want to because he’s doubting whether it’s worth it. His believe is that he preservers a better life quality this way. 

It’s going too fast for me and I’m devastated",,Yes,No,No,Yes
post,throwaway17878456,TrueOffMyChest,5,2025-10-16T08:49:54Z,https://www.reddit.com/r/TrueOffMyChest/comments/1o80zq9/my_job_is_ruining_my_life/,"My job is ruining my life

I don’t really know what the point of this is, I just need to vent really.

I have a good job, work from home, decent salary. We recently hired a new line manager who has made the working environment so frustrating I cry every morning before work.

He sends massive chat GPT written instructions for multiple different ways in which we need to report the same data over and over again. I asked for some clarity and leeway on the format of this and he just dismissed me. Asking a question leads to a 3 hour long teams meeting in which he word salads his way around the same point again and again without just giving me a yes or no. I’ve been speaking to recruiters and applying for other roles but haven’t had any luck so far and it’s honestly driving me to a point where I feel completely trapped and want to run away.

I loved my job before this happened and now I feel like I’m drowning all week to just sleep at the weekend because I’m so stressed and overwhelmed",2.0,Yes,Yes,Yes,No
comment,Chicken_and_noodle,AskDocs,5,2025-10-08T20:39:24Z,https://www.reddit.com/r/AskDocs/comments/1o1ka7v/am_i_pregnant_or_is_something_wrong/nihi5zk/,"NAD

If you haven’t had sex ever, you are right- you aren’t pregnant. 🙂 It’s not uncommon to have irregular periods when you are young and your cycle is relatively new. Let your mom know, though!  And try an app like ‘stardust’ that can help you track your period and symptoms.",,Yes,No,No,No
comment,Leeola_Mcgillicuddy,TwoXChromosomes,5,2025-10-09T04:59:25Z,https://www.reddit.com/r/TwoXChromosomes/comments/1o1qtxn/why_on_earth_do_men_invalidate_anything_they_cant/nijqnir/,"This is why painful menstrual disorders are undertreated,  underfunded,  misdiagnosed,  not diagnosed , diagnosed as mental issues , ignored,  undermined , and many women are driven to desperate measures to try and live with the fallout of all of this. Those that think like that have been able to control the medical industry,  gatekeep what medical conditions they want to accommodate and validate, why men are more easily prescribed pain medication despite being more likely to abuse substances and many other horrific things concerning women's health. The humans of this world are very destructive and inhumane to women.",,Yes,Yes,No,No
