content_type,author,subreddit,score,created,url,text,num_comments,Consumer_Vulnerability,Service_Failure_and_Recovery,Trust_and_Relationship_Breakdown,Marketplace_Exclusion_and_Identity
post,RecommendationOk1021,WomensHealth,1,2025-10-15T00:20:41Z,https://www.reddit.com/r/WomensHealth/comments/1o6wfuu/was_prescribed_progesterone_to_regulate_period/,"Was prescribed progesterone to regulate period while trying to conceive

So I am 30 years old and I have oligmenorrhea,  the oligmenorrhea is unknown cause but suspected pcos. I have been trying to conceive for almost 3 years. My period cycles are 3-7 months average is 5 month in between periods, obviously not normal but my periods while on the moderate to heavy side last normal 5-7 days.  It took me forever to get into my current obgyn as my new primary(moved last year) was essentially refusing to refer me to an obgyn as he did refer me to a repoductive endocrinologist who essentially refuses to see me without my husband who is now on a deployment(which was unplanned and my husband was supposed to be hom in September), before I escalated I went to urgent care who suspected I had an ovarian cyst due to pelvic pain on my left side and told me to go back to my primary to get reffered I had to escalate above my primary dr to get the referral.

In mid july I started a period that ended up lasting over a month and a half. I saw my current obgyn in mid august during this abnormal menstrual cycle, prior to seeing him I went to the ER after urgent care advised me to due to the bleeding being moderate and getting worse everyday and I started expercing light headedness and fatigue they found a ovarian cyst on my left ovary. My obgyn told me to take progesterone for 14 days to stop the bleeding and to regulate my cycle and to start taking it 14 days on 14 days off. The bleeding got worse on the progesterone and I ended up back in the ER with left side pain, they refused to do an ultrasound, and told to go back to my obgyn my obgyn did not answer and I essentially ended up in the ER again for a 3rd time where they did a 2nd ultrasound where no ovarian cyst was found but there was free fluid(was told it did not rupture and most likely went away on it own). During the whole thing I got my bloodwork back from the obgyn appointment and was so confused when my obgyn only tested my testerone/thyroid both came back abnormal. I stopped the progesterone the same day as the 3rd ER trip as it was the 14th day taking it and the bleeding stopped 2 days later. When my current Obgyn did not amswer again I got an appointment with another obgyn but the soonest avaible appointment is late november.

I am still taking the progesterone as prescribed but I end up bleeding on it, last time I started bleeding on day 6 of it and I bled like I was on my period but lighter but still full flow and I stopped bleeding before the end of it, I reached back out to the obgyn that prescribed tge progesteronr and they essentially told me I needed to go back on birthcontrol for now, I again emphasized I am trying to conceive and they told me its because I have pcos. I am now essentially waiting for the new obgyn appointment but ij the meantime I am still taking the progesterone as presribed. 

I really dont know if its normal or not to bleed while on progesterone or not. Should I continue taking it?",1.0,Yes,Yes,No,No
post,Wildbirdcrossing,Perimenopause,1,2025-10-13T15:43:46Z,https://www.reddit.com/r/Perimenopause/comments/1o5na60/41_yo_missed_period_on_hormonal_bc/,"41 YO, missed period on hormonal BC

Really freaked out because I missed my period for the first time while on hormonal birth control pills.  I took several pregnancy tests that came back negative.  I’m 41, healthy weight, and I follow the Whole 30 diet a majority of the time.  Is this normal?  I had some very light spotting the week prior to the sugar pill week.  

I weirdly experienced normal period symptoms- moodiness, bloat, gas, kind of an achy feeling down there but boom nothing.  

Last month I spotted for a week then finally got a period.  I thought that was strange too.  

Has anyone else experienced this?  I’m not interested in having anxiety over whether or not my period is going to come each month.",0.0,No,Yes,No,Yes
comment,Fit_Chocolate_8268,TwoXChromosomes,1,2025-10-09T14:50:23Z,https://www.reddit.com/r/TwoXChromosomes/comments/1o26fgx/how_to_move_forwards_when_i_feel_so_conflicted/nilsv2b/,"That’s a really beautiful and supportive comment thank you. Yes I have been through A LOT. And I’ve worked so hard to try and not be a person that ever puts my pain into others you know. Use it for a better purpose. I guess I’ve just lost faith that other people at least men anyway, considers others in the same way. I’ve considered trying to put myself in the space of others in a friendly way at least just to build back up hope or trust that there are good people out there. It’s just hard as I don’t really get much time to even do that. Just sat with my own thoughts that are pretty heavy, wanting to experience new things but feeling the weight of the past you know. Thank you x",,No,Yes,No,No
comment,Great_Cucumber2924,TwoXChromosomes,1,2025-10-09T11:38:20Z,https://www.reddit.com/r/TwoXChromosomes/comments/1o22am3/weird_medical_issue_docs_dismissed_should_i_ask/nikw38d/,"Do you mean hard lymph nodes? I looked into this a while ago when I found one on my neck. Lymph nodes can go hard after an infection for a while. It’s called ‘shorty’ lymph nodes. I also got very worried at the time but it was nothing. 

Not a doctor but my understanding is some of the full blood count results would be abnormal with cancer usually so if yours are normal then hopefully you’re fine.",,No,No,No,No
comment,gwainbileyerheed,TwoXChromosomes,1,2025-10-08T22:37:23Z,https://www.reddit.com/r/TwoXChromosomes/comments/1o1m85l/when_does_talking_get_easier/nii412k/,"Pain is exhausting. Think how extra tired you can get when you get a headache. Mental pain does the same thing. 

My experience has been that you need to build up callouses with sensitive topics. Discuss them to death, if you will. 

I am super blunt now about the trauma I experiences as a young teenager &amp; it used to make me feel incandescent with a cocktail of negative emotions.",,Yes,No,No,Yes
comment,shitforbrainsidiot,AskDocs,1,2025-10-09T00:36:48Z,https://www.reddit.com/r/AskDocs/comments/1o1rxf0/dry_drowning/niinvyk/,"okay cool, thank you ! sorry, my mom is really worried because of my asthma and the fact i inhaled a bunch of water in my school’s pool. i’ve been lightheaded and had shortness of breath since then. we know a few doctors and nurses, but neither of which had gotten back to us when we asked them, and we aren’t sure if we should even go to the doctor.",,No,No,No,No
comment,thaiearltea,AskDocs,1,2025-10-09T05:44:06Z,https://www.reddit.com/r/AskDocs/comments/1o1so4r/calf_pain/nijvmbu/,"i think this would be worth going to an urgent care for - the symptoms you describe are similar to those of a DVT. it’s better to check than to miss a small DVT, especially since you’re pregnant. urgent cares can manage DVTs as well, just call ahead to double check that they have the proper equipment (and this will save u some money as well!)",,Yes,No,No,No
comment,xCharmingPear,TwoXChromosomes,1,2025-10-09T14:34:22Z,https://www.reddit.com/r/TwoXChromosomes/comments/1o22ii7/womens_health_is_never_taken_seriously/nilpnwz/,Honestly this sounds way beyond “stress.” You’re listing off every red flag possible and your doctor’s out here handing you a milk prescription like that’s gonna fix it. You deserve someone who actually listens before you end up diagnosing yourself better than they ever could.,,No,No,Yes,No
post,Artistic-Dark-8653,WomensHealth,1,2025-10-13T21:53:48Z,https://www.reddit.com/r/WomensHealth/comments/1o5xi4p/idk_whats_happening_to_me/,"Idk what’s happening to me

Hi ladies
I’m at a point with my health at which I really don’t know what’s going on and it really causes me tons of anxiety now.
So Im 21 and haven’t had my cycle for about a year now. By that I mean no ovulation and no period. My life was stressful like it’s always been and I don’t think it’s things normal ppl don’t deal with. I’ve gained 15kg in that year, and really struggle to lose the weight. Even when I eat in a caloric deficit I feel like the scale doesn’t move and I have this belly bump I didn’t have before. I sometimes wonder if it’s not just being bloated on top of the fat in that area.
I’ve also been feeling this discomfort/bulge in the area of my right ovary and I had it checked and scanned but it looks fine. I did go to a gyno and she pretty much told me she can’t help me. I went to an endocrinologist and run bloodwork which came back with high potassium, testosterone and DHEA-SO4 and too low estrogen. 
Plus for a few months I developed a bladder problem where I need to pee almost immediately after drinking anything or at least way faster than before. I also seem to not hold it in enough which causes me to pee myself a little all the time and I have to wear a pad bc of it. I feel like some grandma and it’s so bad.
Now I also got an additional problem since I’ve moved countries I’ve had diarrhea for over a week. 
I really feel so scared and frustrated. I’m all alone in another country and meds here are double expensive and I don’t know the language well. 
Back home I went once to a Chinese doctor and she told me I have cold type inflammation (according to their medicine) blocked energy in kidneys, ovaries and liver. Gave me herbs for it but I haven’t been taking them that long and I stopped now with the stomach problems. I don’t trust conventional medicine that much either since with most my other health emergencies they didn’t help or made things worse and I had to find my own way. 
Also maybe it’s worth mentioning I was on the pill since 16yo for 2 years then I stopped. I also took the day after pill once last year.

If u have any ideas what this all can be or advice what to try I’d be grateful.",1.0,Yes,No,No,Yes
post,Constant_Specific815,WomensHealth,1,2025-10-12T05:36:45Z,https://www.reddit.com/r/WomensHealth/comments/1o4h0pv/extremely_high_resting_heart_rate_after_ovulation/,"Extremely high resting heart rate after ovulation?


I’ve been trying to get a proper diagnosis for what’s been going on with me. Different doctors have mentioned things like POTS, IST, dysautonomia, reactive hypoglycaemia, PMDD, CPTSD, hormonal imbalance, high cortisol, panic disorder, and anxiety. But are unable to reach a clear reason.

The thing is, nothing really seems to fit. Because symptoms every month are so different. They come and go completely at random. And I don’t know what to suspect.

Last month, around my period, things got really bad. My heart rate was so high I could barely function, and I’m pretty sure I had episodes of SVT along with extreme insomnia that still hasn’t improved. I physically can’t seem to sleep more than about four hours a night, and it’s been like this for almost two months.

Usually, I only get heart rate issues the week after ovulation, but this time it lasted the entire cycle. My resting heart rate was around 115-130bpm just laying there and on walking or doing anything over 170bpm. Mind you I never got breaks for it coming down this month. (this isn’t normal for me) my heart rate is very normal most months, yes it gets high sometimes but never like this. I’ve been the emergency room 4 times just this month for this. Doctors can’t find anything wrong. Some even say anxiety and make me feel crazy but wouldn’t you panic if your heart rate didn’t go down? 

I’ve had pots symptoms before (last year) but usually it clears up and these flares come out of nowhere! I don’t meet the criteria for pots. My blood pressure is normal or on the lower end of normal. I’ve had every test done for my heart, seen cardiologists, and my heart is structurally fine. My thyroid and iron levels are completely normal too.

I honestly couldn’t believe how high my heart rate got this month. I know this isn’t just anxiety — it feels like my hormones have completely thrown my nervous system off balance.

Has anyone else experienced something like this?",0.0,Yes,Yes,No,Yes
post,ducksandthings1254,WomensHealth,1,2025-10-15T22:39:17Z,https://www.reddit.com/r/WomensHealth/comments/1o7pi2u/prolapsed_uterus_or/,"Prolapsed Uterus or??

I’m F20, and I’ve never had many issues with my periods except for them being super heavy and leg pain. 

I know this is something I should just get checked out, but even the thought of going to a gyno makes me panic, as I’ve had bad experiences with doctors in the past. 

Sometimes I’ll notice when I go to wipe, that the opening near my vagina is hard. It’s not often. Maybe once every 5 months if even. 

I’m currently on my period, and noticed it again yesterday, but it didn’t hurt or anything so I shrugged it off. This morning I went to use a tampon and it was difficult to get in, and it didn’t stay very long. 

The opening is still hard sometimes, but sometimes it’ll relax back inside a bit. I’m assuming it’s my uterus, but I’m unsure? 

I read online that it could come with constipation, which I do have right now, and I was straining. I also have a desk job and the sitting puts pressure on my bottom. 

But Google results are inconclusive as one tells me I should run to the ER and another tells me it’s normal. 

I stopped tampons for the rest of the day and it seems to have calmed a bit, but I have major anxiety about it.

Has anyone experienced this before? I’m worried.",6.0,No,No,No,Yes
post,Rosalinella,WomensHealth,1,2025-10-16T08:35:32Z,https://www.reddit.com/r/WomensHealth/comments/1o80s5j/help_pelvic_pain/,"HELP_Pelvic Pain

 (Anyone else having these same issues but have been diagnosed)

I am 25, and most my life I have experience irregular, Heavy painful periods rare month it lasted 6weeks ish. Since 14 i was in surviving mode therefore I do not recall much pains, except horrible cramps which is just brushed off as normal.
2023 I went ED for this pain, and for the reminder of the year I was in and out of ED, GP appointment and missing days-weeks off work. 

All routine tests and ultra sounds came back normal except for two things at my initial ED visit and infection which was treated and ruptures cysts, and still im in pain, with no real answer. 

My pain moves lower abdominal and back, thighs/knees dull, sharp, shooting, stabbing, intense and deep. Comes and goes. 

2024 i lost my good doctor and pain was isolated to period cycle with the occasional pains here and there. 

Fast Foward this year the last month my pains have been back same drill with ED/Drs same results. I've started gaslighting myself saying thinking my pains arent ewaly or valid... because there not dull enough anymore for me to ignore and push past.. but not enough to be again... 

I've tried most pain meds, the pill, anti inflammatory, pelvic exercise ( avoid due to current lack of food in take in the last month) meds tramadol no longer assist. Panadol and codine will dull any intense pain if im lucky, hot water is on and off someday it helps other days it increases the pain. 

Any experience advice would be a good step forward, I live in Australia NT so most of you healthcare are uninformed, trained or just think we arw chasing the next high.",0.0,No,Yes,Yes,No
post,Leather-Vegetable409,WomensHealth,1,2025-10-16T08:35:47Z,https://www.reddit.com/r/WomensHealth/comments/1o80sa4/normal_amount_of_discharge/,"Normal amount of discharge?

I went off the pill after 15 years to find out I have PCO and Hashimoto's. Since stabilising my thyroid and starting to ovulate again, I seem to randomly get lots of discharge. I'm talking a small gush that feels like I've wet myself a bit! If I'm standing without undies on it has dripped down my legs. It does happen often, maybe a couple of times a month? It's liquidly and clear or milky coloured! Is this normal?!",0.0,No,No,No,No
post,Inevitable-Spell4056,WomensHealth,1,2025-10-13T00:22:05Z,https://www.reddit.com/r/WomensHealth/comments/1o558j1/breast_healthtissue_question/,"Breast health/tissue question

Hi there- i would like to preface this with I am making an appt my with my OBGYN tomorrow morning, but i feel worried bc i have anxiety and thought id come here to hopefully ease my worries a bit. 

First off- I had a baby back in march but only breastfed and pumped for about 3 weeks before completely weaning and switching formula. 

I was giving myself a self exam last week and felt a hard bone like “lump” directly above my nipple. It started hurting only because i was rubbing it like crazy. 

Could this be tissue? Milk glands still? A bone? It feels like a bone and after rubbing it, it does hurt like a bone would after bumping into something lol. 

I guess it’s just confusing because im not sure what’s “normal” for me after having kids. Im only 32. I want to just go to the doctor to see if they can take a look to tell me what’s normal for me or not so I know. 

Has anyone gotten a mammogram or ultrasound before 40 to know what their baseline is? I have no history of any type of cancer in my family so i feel like it’s hard for me to convice a doctor to do that for me.",2.0,No,No,Yes,Yes
post,EpicShkhara,WomensHealth,1,2025-10-13T15:12:59Z,https://www.reddit.com/r/WomensHealth/comments/1o5mfm1/early_period_obgyn_anxiety_pcos_peri_something/,"Early period, OBGYN anxiety. PCOS? Peri? Something worse? Talk me down!

Some background information - and please read the whole post. 

For most of my life after puberty, I’ve had the least bad periods anyone could ask for. Cycles were long and periods were short. Let’s say, a 3-day, painless period every 35-40 days. It’s been a breeze. I was also a competitive distance runner until I started having hip problems at 33. Even after I stopped running, I have still been pretty active and athletic, and the periods have been similar. 

I maintain a healthy weight of 118-125 lbs at 5’4. I am 37.

I have never been pregnant and do not plan on having any children. Without getting to into this, I have dealt with pain during penetration (vaginismus and excess tissue) that prevents me from having regular intercourse. I have had pelvic exams and require an immense amount of lidocaine. I engage in other forms of sexual activity with my partner of one year. I don’t use any hormonal birth control (used it once in 2010 and HATED it) and was always too squeamish about IUDs. 

I’m having an OBGYN visit next week, the first in five years. I know I’m overdue. It’s been something I’ve been anxiously avoidant about and am finally doing it. I have very high anxiety. 

So back to my period.  I had hip surgery back in February and had noticed my menstrual cycles becoming shorter since then. I attributed it to having less physical activity during the recovery months, but now I’m back to full athletic activity (minus running) even so, my cycles shortened to 28-30 days. 
This month, however, I’m already noticing the telltale signs of the period being near, the tender breasts and minor bloating. If this is it, this period is 10 days earlier than the last one. 

Could it be stress? The anxiety of the upcoming OBGYN appointment? Other stress to do with work? The 26 mile hike I took last week? My diet hasn’t changed. 

Could it be perimenopause already? None of the women in my family went through peri or menopause at my age. My mother gave birth to me at 39. My sister hasn’t gone through it yet and she’s 46. I don’t think anyone went through all the hormonal changes until closer to 50. 

Could it be PCOS? I’m going to ask for a test next week, but id never consider it because my periods were always regular before (just longer cycles), and I’ve never had any of the classic symptoms like wait gain. I have, however, had the issues with random coarse chin hair, which I deal with by dermaplaning almost daily. It’s annoying - almost enough to spend the money on electrolysis. I don’t notice the same amount of hair that people with PCOS talk about, but I’m self conscious (or vain) enough to not want any visible hair. I noticed the hairs on my upper lip and chin growing longer around age 20, to which I said NOPE, DON’T WANT THAT, and started trimming them, then dermaplaning. I had one hormone test at age 21 after recovering from a case of mono, and they were normal. 

Anyways, wish me luck on my upcoming appointment. I have extreme anxiety both about the chance of a bad diagnosis AND the pain during examination. I’ve been in therapy for years about it.",3.0,Yes,Yes,Yes,Yes
post,Own-Cartoonist5058,WomensHealth,1,2025-10-12T10:35:30Z,https://www.reddit.com/r/WomensHealth/comments/1o4lqoh/oversleeping_and_getting_worried/,"Oversleeping and getting worried

in the past few weeks I (22F) have slept at like 6pm by accident and woken up at 5 am about 4 times. i have also taken 2-3 hour long naps about 2/7 days for the past few weeks. Not normal for me. Does anyone, particularly a woman, have any insight into oversleeping to this degree? 

For context, i am a lot more busy now than i used to be before september as i am a working university student. I also bike everyday and often times undereat by about 200-300 calories. However, as stated, oversleeping like this is abnormal for me, and I am beginning to get worried. 

I get my period fairly regularly, and no health concerns other than iron deficiency and depression (depression… I think. Idk if im depressed or if this is just who I have become. No rediagnosis in years.) 

I can already see many potential reasons for my state in my post, but id rly appreciate some discussion, maybe some advice on how to take better care of myself so im not oversleeping, because i get really stressed thinking abt the time im missing out on, and then that stress makes me just wanna sleep and not think about anything even more. 

Thanks,
N",1.0,No,No,No,Yes
post,Geenra,WomensHealth,1,2025-10-12T20:04:55Z,https://www.reddit.com/r/WomensHealth/comments/1o4z6wh/difficulty_peeing_after_bv_treatment_high_health/,"Difficulty peeing after BV treatment, high health anxiety :( What might this be?

Hey all,

I've posted about this a few times before and everyone's always helpful. This latest development has me extra stressed and my health anxiety is already bad. Here's the sitch:

\- Open myomectomy nine months ago to remove a giant fibroid, okay since but day 1 and sometimes day 2 of period has become very painful (last month was improved though). Have been dealing with pelvic floor dysfunction for over a year and am in pelvic floor therapy/taking Miralax twice a day every day since.

\- Started having trouble peeing several weeks ago and urine tests showed bacterial vaginosis (gardnerella). Negative for ureaplasma. Tried metronidazole and had bad side effects, so they switched me to Clindamycin vaginal cream. It was stressful but I finished the five day course

\-Had to go to the ER because I could barely pee, but was able to go once I got there (probably partly health anxiety, ugh). They saw no bacteria or evidence of UTI, but started me on Flomax; one dose helped for three days and then the symptoms started coming back, so I am now on Flomax again. Saw a urogynecologist last week who said things looked good, but have another appointment in a few days since urinary symptoms came back

What I'm currently experiencing is a little difficulty getting the stream started, difficulty getting all the urine out, and a little leakage. I also don't seem to feel how full my bladder is, thought after that first Flomax pill I started feeling it more, so maybe a few more days will help on that. The ER doctor said Flomax is a temporary fix and I need to figure out what's going so I can pee normally again without depending on medicine.

I don't know what could still be causing this if the BV is gone! Has anyone else dealth with this? What kinds of tests or possible causes should I ask the doctor about?

Also, I'm trying to avoid aggravating the urinary stuff or risking C. Diff over the next few months and am not sure if ibuprofen or tylenol are safe for my period cramps. Any advice?

Please help :(",1.0,Yes,Yes,Yes,Yes
post,bbyoda04,WomensHealth,1,2025-10-14T00:05:17Z,https://www.reddit.com/r/WomensHealth/comments/1o60kaf/need_advice_health_anxiety_lsil_result_and/,"Need advice (health anxiety, LSIL  result, and spotting)

Hi I know a lot of responses to this will be to see my doctor, and I am, but I have really considerable anxiety and need to hear from other knowledgeable people that what is happening to me is ok. I am a 21f and a few months ago I had my first pap, it came back with LSIL and really freaked me out. It scared me so much I’m repeating in 6 months instead of a year. My original pap did not include an HPV test because of my age, but I will get one with the follow up. I have no other known infections/STI/STDs. 

The last couple months I’ve noticed some light spotting during my cycle, I’ve been on the pill for years but now I’m noticing it. Specifically my period stops then I get some brown discharge a few days later, and before my period I get light brown/pinky discharge. 

I have no pain, no smell, no itching, no other symptoms. Everyone in my life has told me I am fine but I am just consumed by this anxiety. 

Please give me any advice or suggestions. Especially about the LSIL result or if the spotting is normal.

Thank you a lot for your help",0.0,Yes,No,No,No
