content_type,author,subreddit,score,created,url,text,num_comments,Consumer_Vulnerability,Service_Failure_and_Recovery,Trust_and_Relationship_Breakdown,Marketplace_Exclusion_and_Identity
post,lafoxieeey,relationships,2,2025-10-08T19:33:06Z,https://www.reddit.com/r/relationships/comments/1o1kkoj/me_and_my_bf_are_fighting_every_day/,"Me and my bf are fighting every day

My boyfriend (17M) and I (17F) have been fighting quite frequently for some time. We have a very good relationship and considered beautiful by many. When I met him, seeing him from afar and without knowing who he was, I heard a voice in my mind say that he would be my best friend, and so it was. We fell in love after a long time of friendship, and since then we have been in a serious relationship for 2 years. Until the beginning of this year, we had never fought in our entire relationship, just small arguments that ended harmoniously and respectfully. However, from February to now, we started to have serious discussions, some for really valid reasons and others (the vast majority) started for no apparent reason (the so-called ""silly fights""). We are very busy due to our routine, which started especially this year, as we are trying to get into college and, on top of that, he has more than 1 job, which makes our time busy. In any case, we always respect each other even in discussions. It turns out that within about 2 months, I feel that the arguments have gotten worse. I've been getting sad very easily, and he doesn't seem to have as much patience with me as he used to. On one hand, I tell him I'm insecure and I feel like whenever I say what I feel, we fight (which is true). On the other hand, he says that I don't listen to him, and I don't pay attention to the details that make him feel bad too. While I crave his frequent attention, he asks me for the same, but I don't understand what I'm doing wrong, even when I ask him to explain it to me. I believe in the power of dialogue, and yet nothing seems to work. I'm very sensitive, and I've already told him that I like him to be careful with his words, especially since it's a delicate moment in our relationship, which is combined with all the other problems in life (the fear of not passing college, family problems, lack of financial support - not from him, who is extremely supportive and makes a point of it -, among others that, added to the fights, are making me very nervous. I know that maybe it's an adolescence problem (although I don't believe that this gives reason for the moment of turbulence, even more so). when we are both aware that this is not something good for us), but I want to resolve this. Do you have any tips on how I can talk to him without the conversations turning into arguments? Or, tips on how to approach this subject with him in a nice way?

---

**TL;DR;**: How to talk without turning the dialogue into a fight?
How can I also not get sad or reactive so easily (in this case, stay calm)?
And, if I am unable to remain calm, what should I do to avoid encouraging a confrontation?",4.0,No,Yes,Yes,Yes
comment,littlefawn1816,TwoXChromosomes,2,2025-10-08T18:42:10Z,https://www.reddit.com/r/TwoXChromosomes/comments/1o1howq/ovarian_cysts_and_frustrations/nigualw/,"I had two pretty good sized cysts on one of my ovaries. I had horrible cramps, monthly bleeding was insane, and back pain. Eventually sex started to hurt in various positions. It finally took a really great midwife to order labs and an ultrasound to find my cysts. I had surgery to remove them 2 months later. Since, the back “knot” I had has gone away, the sharp pain on that side is get is gone, and so far sex has become much more enjoyable. I’ve only had one period (HBC removed) but bleeding was significantly better and my cramps were so much more manageable! 

It sucks being a woman sometimes.  I found it was helpful to try various sex positions — some were way more comfortable than others and a partner with patience and love is the best to explore those with! I’ll also say I’m glad you’re scheduled for an appointment to look into it. There are really amazing providers out there who will take the time to listen, empathize, and get you where you need to be. Hang in there!",,Yes,No,Yes,Yes
comment,DragonStryk72,TwoXChromosomes,2,2025-10-09T04:14:50Z,https://www.reddit.com/r/TwoXChromosomes/comments/1o1qtxn/why_on_earth_do_men_invalidate_anything_they_cant/nijl9xy/,"Well, first, there's the important rule that generally speaking, the most extreme opinions on the Internet are generally the same people posting repeatedly.

Second are the folks that are intentionally trolling or ragebaiting. They're literally in it to get people to spaz out.

Once we get past that, we've got the fact that guys invalidate a lot of things, male or female. Depression? It's nothing, you just need to have a scoop of peanut butter. And the reason is basically: They tear down because they got torn down. While the atmosphere IS changing, a ton of guys were raised on that sort of constant invalidation, especially in regards to emotional and physical pain.",,Yes,No,No,No
comment,query_tech_sec,TwoXChromosomes,2,2025-10-09T04:08:46Z,https://www.reddit.com/r/TwoXChromosomes/comments/1o1qtxn/why_on_earth_do_men_invalidate_anything_they_cant/nijkikf/,"Years ago after the first Trump election there was something going around about pregnancy being a medical condition or not. And there seriously were a bunch of men who said that ""childbirth is natural"" and ""women have been giving birth in fields"" so basically it didn't matter if pregnancy costs were coved by healthcare because it could always be handled the ""natural"" way.

So - yes - men like that will absolutely do that and it's because patriarchy says they shouldn't relate to anything uniquely female because it demeans him.",,Yes,No,No,Yes
comment,Voidtalon,TwoXChromosomes,2,2025-10-09T05:09:35Z,https://www.reddit.com/r/TwoXChromosomes/comments/1o1qtxn/why_on_earth_do_men_invalidate_anything_they_cant/nijrtpz/,"So I guess those men shouldn't take painkillers for headaches? For Soreness after a workout? For pain after doing all that manual labor in the yard?

It's natural after all. /s

Sadly, your last line is the reason, there are a lot of people (many men) who see women as property, weak and lesser than men (thanks Religion).",,Yes,No,No,No
post,confusedcow232,relationships,2,2025-10-16T09:05:06Z,https://www.reddit.com/r/relationships/comments/1o817x0/im_unsure_to_stay_with_my_bf_what_do_i_do/,"I'm unsure to stay with my bf. What do I do?

TL;DR: boyfriend of two years (LDR for 10 months) is controlling of my privacy, interests and hobbies (fiction and fictional characters).

Hello, this will be a long post... so bare with me.

I (24F) have been together with my bf (26M) for over two years now, earlier this year he had to move abroad with his family and we have been LDR for nearly 10 months now. Before he left the only thing I asked from him was emotional support and stability, the material stuff or money is something I can handle by myself, however I wouldn't turn him down if he ever offered.

I've never felt there was something toxic between us, maybe I was too blind at the start or until we had to become long distance.

During the first months of us being LDR, it felt like I had to take more initiative to make calls. He wasn't really putting enough effort into it like I did. He also kept the conversations surface level which resulted to me being scared of opening up to him if he didn't ask. It didn't feel right to just dump my feelings on to him when he was going through a lot while moving places.

During Summer I visited him once for a week, it felt okay, nothing wrong. Though it felt like something was missing, it was the emotional part, the reassurance. I didn't think much of it once I came back home as I started working as usual.

After some time I found myself starting to like my old hobbies again, I didn't really have time or energy to indulge myself into my old hobbies as much when he was here, it felt like I was more indulged into our relationship before and lost a part of myself. Some of my hobbies I ""rediscovered"" being anime and fiction. My boyfriend however have had strong opinions about these things earlier in our relationship.

Last year 2024, we were 8 months in, I discovered something on his phone which I didn't like. It was naked photos that he had kept from girls he used to interact with before meeting me. It wasn't just 3 or 5 people, it was up to probably 30 different girls. I was disgusted, grossed out. I demanded him to delete the photos in front of me, but he deleted them once he was back to his home. Whether he saved them somewhere I don't know. He claimed he never checked his camera roll to look back at them, but for me it didn't matter. He should've deleted those off his phone especially when we were already 8 months in to our relationship. This completely changed my perspective on him.

Some time after I discovered these things, he confronts me about my old tweets, tweets from 2022-2023. Before we even met. (I used to have a fan account, tweeting about anime characters and KPOP idols... lol) he thought I was being weird for saying things about them and tried to confront me if I still liked these things. At the time I didn't like it as much, so I was honest and told him. I asked him how he found my old Twitter accounts, turns out he hacked into my email. I felt violated. I was too nice and forgave him.

Fast forward to 2 months ago. After my second visit in late Summer for his birthday, he had grown suspicions about me. He did ask me again if I liked those stuff and a part of me was too scared to confess. I knew what he thought of it and I was embarrassed. So I told him no. I thought his suspicions would stop there, but I was wrong.

He also mentioned how he thought my friends was being disrespectful towards our relationship for sending me edits of fictional characters and celebrities. I however thought it was ridiculous, I don't even relate to my friends when they send me those things, I just think it's a funny thing.

Fast forward a month ago. He was acting very weird with me, stand-off ish through text. On a Monday when I had my exam that I had been studying for tremendously. He started to complain about how I didn't talk to him enough, sometimes after class I could accidentally fall asleep in my bed. Sometimes I was off studying and I was updating him about everything. He also mentioned how some of my updates didn't matter to him or how unnecessary they were. My updates being ""I'm tired"", ""I'm hungry"" or ""I'm stressed"". He said he provides me with solutions but I don't listen to him. I told him solutions is sometimes not the only things I want. Sometimes or majority of times I just want to be seen or understood, but he doesn't understand that part.

That same week on Friday, he crashed out on me. He was able to somehow hack into my search history and found things I had been reading or watching about fictional characters. He called me weird, fcked up and also compared himself to this fictional character. I was stunned and hurt. He also mentioned my mom being weird for having celebrity crushes and how it's ""genetic to be a cheater that way"". He also compared me to my friend and used my past trauma of my ex against me. He was upset that some of the things I had searched up was 18+ of a character and he questioned why I didn't turn to him for these ""needs"", I told him sending naked photos and such doesn't do the same for me. I also told him about the lack of emotional stability between us... however his focus was on the sexual part only.

I was hurt, it felt like there was something wrong with me. I was confused as to what he truly thought of me, he thought I was a fcked up freak, his true thoughts and opinions surfaced about my friends and family. I was confused.

First week after this fight, he started calling me new baby names that he has never called me and he tried initiating calls everyday. He claimed that he had been reading our old conversations and noticed how off he was. This week was also my first week of an internship and I wanted to put my 150% energy into this. So I had to tell him off, not only cause I was busy. But it didn't feel genuine with the way he called me a freak a few days earlier and now I'm his sweet pumpkin? It just felt forced.

Fast forward to present day, a few days ago he complained how I was following fan art accounts because some of them had shirtless art of a fictional character that I liked, he also didn't like how I was tweeting about a KPOP group member. (Mind you, my boyfriend is a gym influencer, he posts his body all the time). But me following fan art accounts is not okay?

A week after, my internship company had a little party and I got a little drunk. A few days later, he complains how I'm trying to find fun elsewhere by getting drunk and such - and not finding fun with him. I was stunned? I became agitated, cause am I not allowed to enjoy drinking? I get more tired every time this happens. I tell myself everytime he complains about something it's gonna get me closer to break it off, but I feel like I'm doing it too much.

He's now trying to push on to plan my next visitation in December, but I'm starting to get unsure. Do I really want to see him? I don't know, I feel kind of independent right now in all ways possible. I don't want to break things off with him on a distance cause it feels rude, but at the same time I don't know how I'll be once I meet him.

What do I do? My mind has been racing and a mess ever since our fight. I'm sorry for this long post, but I needed to vent for the world.",5.0,Yes,Yes,Yes,Yes
post,AcHaeC,TrueOffMyChest,2,2025-10-16T08:23:34Z,https://www.reddit.com/r/TrueOffMyChest/comments/1o80lun/terrifying_experience_when_i_was_attacked_by_a/,"Terrifying experience when I was attacked by a dog as a kid while walking to school

I was about 8-9 years old and was walking to school with my older sister who was only 2 years older than me. Then I stood still to get my dime chocolate and eat it. As I was opening my chocolate bar, all of a sudden, out of nowhere, I get jumped by a dog from behind. It was a husky I believe.

Now my sister was far ahead, and when she saw it happen, she ran away to school scared. I was all alone. The dog’s owner wasn’t around, and I was in a sort of a park where no cars had access to, so no cars driving by to save me, and nobody else was there at the park to save me either as it was in the early morning. I had to fight the dog myself.

When it jumped me, I fell to the ground and there I am lying on the floor. Then the dog rushed at me again, but I kept kicking it in the face while lying on my back with both my legs while screaming and crying, it felt HORRIBLE. You can’t imagine what such an intense situation felt like as such a young boy. My heart was pounding out of my chest.

It kept lunging and lunging, but every time it did, I kicked it in the face with both of my feet. And eventually one of my boots flew off from all the kicking, but I never got bit because I kept resisting, I kept fighting. Every time it lunged at me, I kicked it in the face. Now this was going on for a long time, can’t remember how long, but it felt very long, well over 30 seconds. Luckily I was never bit with my tactic of spamming kicks in its face.

Eventually, the owner came and retrieved her dog by making it come over to her. I got up while crying on the same spot where I fought, and there she was standing with her dog beside her. She never said a word to me. She just stood there with her dog. I can’t remember much of what she looked like, but I still have a figure of her in my head: short haired, thin, maybe fit, had a cap on, and was probably in her 30’s.

Then I kept on walking to school with teardrops all the way. Don’t remember if I ever took my chocolate bar back. When I talked to my sister again in school, she said was she was scared and ran to school, but she never ever told a teacher that I was attacked when she reached the school. That’s fucking insane. Like imagine I wasn’t so brave and couldn’t fight back that dog before the owner came, I coulda been mauled to death. Hate my sister for that, and she’s always been narcissistic like this even as we grew up, only caring about herself.

And I even told my teacher, but she didn’t seem to care that much. She never contacted my parents or the school, almost like she didn’t believe me. But I still do wonder why that dog owner did nothing. It was such a long time ago that I don’t know if I have hatred for her. No responsibility, didn’t check on me, didn’t even say a word. I still wonder why.

I’m 18 now and I hope you guys can learn from my terrifying experience and maybe share it with your kids and teach them and other people what to do if this happens to them. It can save them. My instincts just took over and saved me.",0.0,Yes,No,No,Yes
post,outofcobertura_01,relationships,2,2025-10-16T01:25:44Z,https://www.reddit.com/r/relationships/comments/1o7t9av/my_21f_online_friend_22m_just_started_acting_crazy/,"My (21F) online friend (22M) just started acting crazy

Well, me and my online friend have been chatting for five and a half months, the main reason we started talking was basically for me to learn Spanish, since I recently moved there so obviously, I need to learn the language, I know other languages, including English, but Spanish is fundamental, clearly. 




One of the most recommended ideas online was finding a language learning partner, since I’m a shy introvert, I haven’t made many friends in my new college, and I really don’t like chatting online—I barely follow the people I know IRL, anyway, I stepped forward and downloaded HelloTalk, and right away, a few invitations popped up, the first one was his.



He’s from Colombia, so he obviously speaks Spanish (with some slight differences from standard Spanish).




We chatted for about an hour, then two, then three, and I kinda liked him, his personality is cool, he’s hardworking, funny, intellectual, and God only knows how much I love intellectual guys.



 the other most important thing is that he didn’t flirt and was completely understanding when I told him I don’t like posting too much about myself, including profile photos in apps I recently used, so basically, at first, he was talking to a ghost, but our personalities matched perfectly.





After a while, he asked for my Instagram, we exchanged it, and he finally got to see how I look, he said I’m pretty and “white” and so on, but I didn’t focus on that much because, as I said, I’m a shy person.



 The frequency of our chats increased even more, it became something we just had to do, and honestly, my Spanish improved so much in this short time, and since I pick up languages quickly, many difficulties were solved thanks to him, I’m a polite person, so I thanked him a lot, actually, every time I use something I learned from him, I turn to our conversation happy and thank him.





But the problem started when he began saying things about “us,” implying that I should confess my love to him, making calls, dating, or even marrying him and getting him a ticket to Spain, I have Spanish nationality, by the way, because my father is Spanish, but he and my mom are separated, and we’ve been living in Italy since I was a kid.




he mentioned the marriage thing over and over, but I ignored it, I thought our friendship was cool and could continue without any romantic purpose, also I thought I clearly explained that I’m not looking for any relationship now and that I have no intentions toward him other than practicing Spanish and being friends.




I couldn’t think straight when he kept talking about our fictional kids, mixing our cultures, showing off his muscles in pictures, and saying he wanted to carry me on his shoulders, I mean things just went mad, so I blocked him.



But I found myself after few hours unblocking him and apologizing for being impulsive, he apologized too for the misunderstanding, and I accepted it, because I wasn’t sure if he really meant what he said, or if it was just a joke, or maybe it’s typical for Latinos to act like that, since he often told me that Latinos are just very expressive, warm and kind more than Italians and Spanish people.




I feel like he hypnotized me, I couldn't block him even if I feel uncomfortable sometimes, even after we made up, I mean, we became a bit more than regular friends, like best friends or whatever, but still…




When I accepted his apology, he thanked me genuinely and promised the marriage thing won’t be mentioned again, he even said he’s glad I’m honest with him. I thought everything was back to normal, just an educational, cool friendship but no.




 Something flipped, and he started cussing sometimes, being offensive about things he found “interesting” at first, like me having a small social circle, my boring romantic life (because I’ve only had one ex, I’m currently single and I date for marriage), and maybe getting hurt in the future since I lack emotional experience, he even said I’m cold, maybe “asexual"".



That he “loves” my insecurities, and asked if I ever heard of a swimming bikini, since all the pictures I post on Insta are in oversized clothes (my style), and that I should send him some photos in a swimming bikini.



I was in shock. I couldn’t understand what happened how did he change all of a sudden? 180°?? Is this a manipulation since I blocked him and felt remorse, and now he thinks I can’t live without him? Or is it revenge to restore his self-esteem? Or is he playing the bad guy so I chase him?



Has this ever happened to anyone? Should I just forget what I liked about him as a friend and cut him off? I’m so bad at making friends or any other relationship, so I’m sticking to this one to have more active Spanish practice. But things just got worse, and I don’t know what to do, maybe this doesn’t seem like a serious issue to some, but for me, it is, because I value the relationships I have so much.




TL;DR: I (21F) met a Colombian guy (22M) online friend to practice Spanish, we became close, but he started pressuring me romantically and making offensive, uncomfortable comments, and now I don’t know whether to keep the friendship or cut him off.",3.0,Yes,Yes,Yes,Yes
post,Ok_Tangerine5769,relationships,2,2025-10-14T14:45:37Z,https://www.reddit.com/r/relationships/comments/1o6hh7d/help_should_i_leave_my_bf/,"Help - should I leave my BF?

I (F 30) and my BF (31 M) have been dating since 2024. My boyfriend has deep trust issues from past relationships, especially after he found out his ex was messaging other guys. For more context when we met in 2024, he still had his ex-girlfriend’s pictures saved on his phone and all over his Instagram. Meanwhile, I’ve changed my number to leave my own past behind (at his request though I didn’t mind) and blocked all my ex’s (some of whom I was friendly with) whilst he was still messaging his during the relationship as they were living together and had ‘bills to settle’. 


However, he’s been looking through my phone for old messages and photos. Recently, while I was out, he went through my
Phone and confronted me about a text and pics from 2020 (five years ago), accusing me of lying and cheating, even though I’ve already been open about those experiences.


He refuses to consider couples therapy because he “doesn’t believe in it,” even though I’ve suggested it would help rebuild trust. Lately, he’s brought up that “men and women think differently,” and keeps placing more and more restrictions on me e.g don’t have male friends (even though he has a female best friend) and he doesn’t like when I go out with some of my female friends. 


For the record, I’ve never gone through his phone or social media, but I feel violated every time he checks mine. 


 I want this relationship to work and want to reassure him, but the constant suspicion and boundaries violations are causing serious distress.


How do I help him feel secure while protecting my own wellbeing and boundaries? Is it normal to want privacy regarding phones and social media in a relationship? What do I do if he refuses therapy or won’t see my side?


TL;dr- my boyfriend is insecure and checks my phone without permission, and controls who I spend time with and refuses to try therapy. What should I do?",6.0,Yes,No,Yes,Yes
